{
  "schema_version": 1,
  "source_commit": "62d22d4ce6241601ace98b682edff824260c163f+K-MELDEN",
  "files": {
    ".agents/skills/evaluating-changes/SKILL.md": {
      "content": "---\nname: evaluating-changes\ndescription: Bewerte, ob eine einzelne Änderung an Prompts, Skills, Auswahlregeln oder Agent-Konfiguration gegenüber einer eingefrorenen Baseline tatsächlich besser ist. Trennt Auswahl, Verhalten, Ergebniswirkung und Zusammenspiel, schützt Testdaten vor Lecks und rechnet den Gesamtaufwand. Nutze bei „ist die neue Variante besser“, „Kandidat gegen Baseline vergleichen“, „Eval-Ergebnisse auswerten“, „A/B-Test für den Skill“, „compare candidate against baseline“, „did this prompt change help“. Nicht zum Erzeugen oder Optimieren von Kandidaten, für Code-Reviews, allgemeine Statistikfragen oder die Freigabe einer Änderung.\n---\n\n# Änderungen evaluieren\n\n1. Lies Ziel, Baseline- und Kandidatenstand mit Hashes, Fälle, Rubrik und Messrahmen. Unterscheiden sich mehr als eine Sache oder Laufzeit, Modell, Werkzeuge oder Eingaben, stoppe mit „nicht vergleichbar“ und nenne die Unterschiede.\n2. Prüfe die Daten vor jeder Bewertung: Splits nach Ursprungsfamilie vorab festgelegt, Paraphrasen in derselben Familie, Testfälle vom Kandidatenautor ungesehen und noch nicht für eine Auswahl verbraucht. Führe Pflichtregressionen getrennt vom unabhängigen Test.\n3. Werte jede Ebene nur aus ihren eigenen Läufen: Format, Auffindbarkeit, Auswahl ohne expliziten Aufruf, Verhalten mit geladenem Skill, Wirkung gegenüber Baseline, Übergaben, harte Regeln.\n4. Nutze nur gespeicherte Rohresultate. Fehlende Spuren, Fehlerläufe und nicht beobachtbare Aktivierungen bleiben unbekannt.\n5. Prüfe Kritisches mit deterministischen Assertions. Ein Modellurteil zählt nur mit fixierter Version und Rubrik, menschlicher Stichprobe und nie allein durch den Kandidatenautor. Länge und Überzeugungskraft sind kein Treffer; jeder Verstoß gegen harte Regeln blockiert.\n6. Berichte gepaart je Fall besser, gleich oder schlechter mit Zähler, Nenner, Familien und Wiederholungen. Bei kleinen Stichproben nur beschreiben; keine Signifikanz ohne tragfähige Annahmen.\n7. Rechne den Aufwand je akzeptiertem Ergebnis: Usage samt Cache, Fehlversuche, Nacharbeit, Bewertungs- und Optimierungsläufe, Längenzuwachs. Kennzeichne gemeldet, geschätzt, unbekannt; keine Ersparnis aus angenommenen Aufgabenmischungen.\n8. Empfiehl verwerfen, mit neuen unabhängigen Fällen weiter prüfen oder zur Aktivierung vorlegen, jeweils mit Rücknahmepfad und betroffenen abhängigen Artefakten. Nutze die [Berichtsform](references/comparison-report.md), wenn keine Projektvorlage existiert. Aktiviere nichts und ändere weder Rubrik noch Fälle.\n",
      "sha256": "1397a01bbffc18c2284c4eea6a221e95da75f468163cd6897dae36b4c7d068ae"
    },
    ".agents/skills/evaluating-changes/agents/openai.yaml": {
      "content": "interface:\n  display_name: \"Änderungen evaluieren\"\n  short_description: \"Kandidat gegen eingefrorene Baseline fair vergleichen\"\n  default_prompt: \"Nutze $evaluating-changes, um den Kandidaten gegen die Baseline zu vergleichen und eine Empfehlung mit Rücknahmepfad zu geben.\"\npolicy:\n  allow_implicit_invocation: true\n",
      "sha256": "0a1c7bedc21c26ea800ad9afaadd496643c5494811c8d09c95e90d02de912478"
    },
    ".agents/skills/evaluating-changes/references/comparison-report.md": {
      "content": "# Vergleich <Kandidat> gegen <Baseline>\n\nBaseline-Hash / Kandidaten-Hash:\nGeänderte Dimension (genau eine) und Hypothese:\nEval-Version / Rubrik-Version / Client / Modell:\nVergleichbarkeit: Unterschiede außer der Dimension → keine | Liste (dann „nicht vergleichbar“)\nLeckprüfung: Splits nach Ursprungsfamilie vorab festgelegt? Testfamilien dem Autor unbekannt? Test bereits verbraucht?\n\n| Ebene | k / n | Familien | Wiederholungen | nicht beobachtbar |\n|---|---|---|---|---|\n\nHarte Regeln: Verstöße mit Fall-ID (jeder blockiert).\nAufwand je akzeptiertem Ergebnis: Wert | Quelle (gemeldet / geschätzt / unbekannt).\nEmpfehlung: verwerfen · mit neuen unabhängigen Fällen weiter prüfen · zur Aktivierung vorlegen.\nRücknahmepfad und betroffene abhängige Artefakte:\nBenötigte neue Fälle:\n",
      "sha256": "3f92af0e9f13b61fa89f9f19a5a7ebde55cb779558b5b02e00b163d2fd01138a"
    },
    ".agents/skills/grilling/SKILL.md": {
      "content": "---\nname: grilling\ndescription: Kläre entscheidungsrelevante offene Fragen zu Ideen, Plänen und Anforderungen durch ein strukturiertes Interview. Nutze bei „grill mich“, „hinterfrage den Plan“, „kläre offene Fragen“, Anforderungsinterviews oder „stress-test this idea“. Nicht für reine Faktenrecherche, triviale Änderungen oder bereits eindeutig beantwortete Entscheidungen.\n---\n\n# Entscheidungen durch Fragen klären\n\n1. Lies Arbeitsregeln, Ziel, vorhandene Antworten und Entscheidungen. Recherchiere zugängliche Fakten selbst und verlinke den Beleg; eine Faktenfrage geht nur an den Nutzer, wenn der Fakt nicht zugänglich ist. Frage nach Präferenzen, Prioritäten und nicht ableitbaren Vorgaben. Prüfe Annahmen kritisch, ohne bestätigte Antworten grundlos erneut abzufragen.\n2. Übernimm den Ablageort aus den Projektregeln (etwa `AGENTS.md` oder `CLAUDE.md`) oder eine vorhandene Fragenablage. Fehlt beides, erfinde keinen Ordner: frage einmal nach dem Ort und führe die Datensätze bis dahin im Antworttext. Lies vor dem ersten Schreiben [Workflow](references/workflow.md) und bei neuen Datensätzen [Formate](references/records.md). Lade später nur Themenindex, offene IDs und benötigte Einträge.\n3. Erfasse Fragen mit stabiler ID, Abhängigkeiten, Priorität und sachlichem Anlass: Quelle, Lücke/Widerspruch, betroffene Entscheidung, Folgen unterschiedlicher Antworten. Speichere keine privaten Denkprotokolle; dokumentiere überprüfbare Gründe und ausdrücklich markierte Annahmen.\n4. Wähle nur Fragen, deren Voraussetzungen beantwortet oder belegt sind. Priorisiere Blockierendes. Frage voneinander unabhängige Punkte gemeinsam, begrenzt durch Tool-Schema und gewünschte Bedienlast; abhängige Fragen folgen später. Erzeuge weitere relevante Fragen aus Antworten, bis der vereinbarte Umfang geklärt ist.\n5. Verwende ein verfügbares natives AskUser-Werkzeug, etwa `AskUserQuestion`, `request_user_input` oder ein entsprechendes Client-Tool, sofern es diese Frage erlaubt. Beachte dessen tatsächliches Schema, Modus und Berechtigungsgrenzen; keine erfundenen Tools oder Vorabfreigaben. Sonst stelle dieselbe Frage im Chat. Erkläre kurz die Entscheidung, biete unterscheidbare Optionen samt Folgen und eine begründete Empfehlung; lasse freie Antworten zu. Keine suggestive Ja-Vorgabe.\n   Ohne erreichbaren Menschen nicht warten und nichts annehmen; Vorgehen siehe [Workflow](references/workflow.md#ohne-rückkanal).\n6. Speichere vor Tool-Aufrufen Fragen und Feld-Mapping; im Chat genügt ein kompakter Rundeneintrag. Erfasse danach die tatsächlich gestellten Fragen, Antworten und Quelle. Teilantworten gelten nur für zugeordnete IDs. Schweigen, Timeout oder übersprungene Felder sind keine Zustimmung. Unklare Zuordnung gezielt nachfragen. Sichere vor Wartepausen den Stand; blockiere nur abhängige Arbeit. Versionen, Doppelantworten und Fristablauf: siehe Workflow; eine Frist erzeugt nie eine Antwort.\n7. Ergänze Antworten nachvollziehbar statt frühere zu überschreiben. Bei Korrekturen markiere betroffene Folgefragen und Entscheidungen als erneut prüfpflichtig. Prüfe danach offene Abhängigkeiten, Widersprüche und nächste Fragerunde.\n8. Schließe mit kurzer Zusammenfassung, verbleibenden Unsicherheiten und dem nächsten Schritt. Ein leeres aktuell fragbares Set kann durch Forschung oder Abhängigkeiten blockiert sein. Erkläre das statt Vollständigkeit zu behaupten. Lasse den Nutzer die gemeinsame Zusammenfassung bestätigen; eine schon ausdrücklich gegebene Bestätigung nicht erneut verlangen. Bestätigung der Inhalte erteilt keine Ausführungsrechte. Respektiere bestehende Autorisierung und den Arbeitsauftrag.\n\nBei Abbruch: Stand als `paused` speichern, Fragen erhalten. Niemals Antworten erfinden oder ungefragt Architektur, Skills oder Code aus einem Interview implementieren.\n",
      "sha256": "f39966b8fad6df037cda482a6c1695538732dc92576ba954113bec13670a6f50"
    },
    ".agents/skills/grilling/agents/openai.yaml": {
      "content": "interface:\n  display_name: \"Grilling – offene Fragen klären\"\n  short_description: \"Entscheidungen klären und Antworten nachvollziehbar sichern\"\n  default_prompt: \"Nutze $grilling, um den Plan kritisch zu hinterfragen und offene Fragen mit AskUser-Werkzeugen nachvollziehbar zu klären.\"\npolicy:\n  allow_implicit_invocation: true\n",
      "sha256": "7a8e89053d4cf30672a5f9afe421fc44566a76b4f191b0f9c39873c5867cf2d3"
    },
    ".agents/skills/grilling/references/records.md": {